[
  {
    "id": "holdout-explicit-health-task",
    "datasetVersion": "1",
    "split": "HOLDOUT",
    "content": "2026.09.14 14:30 치과 예약 확인",
    "baseInstant": "2026-08-05T02:00:00Z",
    "timeZone": "Asia/Seoul",
    "expectedRoute": "LOCAL_REVIEW",
    "expectedTypes": ["TASK"],
    "expectedSignals": [],
    "notes": "A precise personal task that should be safe to review locally."
  },
  {
    "id": "holdout-architecture-information",
    "datasetVersion": "1",
    "split": "HOLDOUT",
    "content": "API 응답 캐시는 사용자별로 분리해야 함",
    "baseInstant": "2026-08-05T02:00:00Z",
    "timeZone": "Asia/Seoul",
    "expectedRoute": "LOCAL_REVIEW",
    "expectedTypes": ["INFORMATION"],
    "expectedSignals": [],
    "notes": "Declarative technical knowledge is information, not a personal action."
  },
  {
    "id": "holdout-exercise-record",
    "datasetVersion": "1",
    "split": "HOLDOUT",
    "content": "운동 기록 스쿼트 80kg 5세트",
    "baseInstant": "2026-08-05T02:00:00Z",
    "timeZone": "Asia/Seoul",
    "expectedRoute": "LOCAL_REVIEW",
    "expectedTypes": ["RECORD"],
    "expectedSignals": [],
    "notes": "A completed measurement is a record and must not become a task."
  },
  {
    "id": "holdout-calendar-event",
    "datasetVersion": "1",
    "split": "HOLDOUT",
    "content": "10월 3일 동창회",
    "baseInstant": "2026-08-05T02:00:00Z",
    "timeZone": "Asia/Seoul",
    "expectedRoute": "LOCAL_REVIEW",
    "expectedTypes": ["EVENT"],
    "expectedSignals": ["MISSING_YEAR", "MISSING_TIME"],
    "notes": "The event type is clear even though the proposed date remains reviewable."
  },
  {
    "id": "holdout-unresolved-document-task",
    "datasetVersion": "1",
    "split": "HOLDOUT",
    "content": "팀장님이 말한 그 문서 다시 보기",
    "baseInstant": "2026-08-05T02:00:00Z",
    "timeZone": "Asia/Seoul",
    "expectedRoute": "CLOUD_ENRICH",
    "expectedTypes": ["TASK"],
    "expectedSignals": ["UNRESOLVED_REFERENCE"],
    "notes": "The action is understandable, but the referenced document is unresolved."
  },
  {
    "id": "holdout-imprecise-weekend-task",
    "datasetVersion": "1",
    "split": "HOLDOUT",
    "content": "주말쯤 병원 예약 잡기",
    "baseInstant": "2026-08-05T02:00:00Z",
    "timeZone": "Asia/Seoul",
    "expectedRoute": "CLOUD_ENRICH",
    "expectedTypes": ["TASK"],
    "expectedSignals": ["IMPRECISE_DATE"],
    "notes": "The approximate weekend expression must not silently become an exact due date."
  },
  {
    "id": "holdout-shopping-task",
    "datasetVersion": "1",
    "split": "HOLDOUT",
    "content": "장보기: 우유, 계란, 휴지",
    "baseInstant": "2026-08-05T02:00:00Z",
    "timeZone": "Asia/Seoul",
    "expectedRoute": "LOCAL_REVIEW",
    "expectedTypes": ["TASK"],
    "expectedSignals": [],
    "notes": "A compact shopping list expresses one clear action."
  },
  {
    "id": "holdout-multi-action-task",
    "datasetVersion": "1",
    "split": "HOLDOUT",
    "content": "논문 읽고 요약하고 발표 자료 만들기",
    "baseInstant": "2026-08-05T02:00:00Z",
    "timeZone": "Asia/Seoul",
    "expectedRoute": "CLOUD_ENRICH",
    "expectedTypes": ["TASK"],
    "expectedSignals": ["MULTI_INTENT"],
    "notes": "Several dependent actions require a reviewable split."
  },
  {
    "id": "holdout-phone-task",
    "datasetVersion": "1",
    "split": "HOLDOUT",
    "content": "엄마한테 전화하기",
    "baseInstant": "2026-08-05T02:00:00Z",
    "timeZone": "Asia/Seoul",
    "expectedRoute": "LOCAL_REVIEW",
    "expectedTypes": ["TASK"],
    "expectedSignals": [],
    "notes": "A short explicit action should be safe to review locally."
  },
  {
    "id": "holdout-relative-event",
    "datasetVersion": "1",
    "split": "HOLDOUT",
    "content": "회의는 다음 주 수요일 오후 2시",
    "baseInstant": "2026-08-05T02:00:00Z",
    "timeZone": "Asia/Seoul",
    "expectedRoute": "LOCAL_REVIEW",
    "expectedTypes": ["EVENT"],
    "expectedSignals": [],
    "notes": "The base instant and time zone make this a resolvable event expression."
  },
  {
    "id": "holdout-unresolved-deadline",
    "datasetVersion": "1",
    "split": "HOLDOUT",
    "content": "그거 다음 회의 전까지 마무리",
    "baseInstant": "2026-08-05T02:00:00Z",
    "timeZone": "Asia/Seoul",
    "expectedRoute": "CLOUD_ENRICH",
    "expectedTypes": ["TASK"],
    "expectedSignals": ["IMPRECISE_DATE", "UNRESOLVED_REFERENCE"],
    "notes": "Both the object and the relative deadline require context."
  },
  {
    "id": "holdout-alternative-decision",
    "datasetVersion": "1",
    "split": "HOLDOUT",
    "content": "예산안 검토 또는 보류 결정",
    "baseInstant": "2026-08-05T02:00:00Z",
    "timeZone": "Asia/Seoul",
    "expectedRoute": "CLOUD_ENRICH",
    "expectedTypes": ["TASK", "INFORMATION"],
    "expectedSignals": ["MULTI_INTENT"],
    "notes": "Alternative intents must not be flattened into one confident record."
  }
]
